{
  "schema_version": "svetlost33-liturgical-catalog-1",
  "version": "2026.10.1",
  "revision": 7,
  "review_status": "approved",
  "approval_id": "shared-calendar-saints-2026-10-02-owner-r1",
  "calendar_profiles": [
    {
      "id": "spc-rs-ba-julian-v1",
      "name": {
        "sr-Cyrl": "СПЦ — Србија и Босна и Херцеговина, јулијански календар",
        "sr-Latn": "SPC — Srbija i Bosna i Hercegovina, julijanski kalendar"
      }
    }
  ],
  "sources": [
    {
      "id": "spc-kirijak",
      "title": "Преподобни Киријак Отшелник",
      "url": "https://spc.rs/sr/news/11852.prepodobni-kirijak-otselnik.html",
      "publisher": "Српска православна црква",
      "original_author": null,
      "checked_on": "2026-09-20",
      "review_status": "reviewed",
      "rights_status": "pending"
    },
    {
      "id": "spc-nicholas-transfer",
      "title": "Празник преноса моштију Светог Николаја у Никољцу",
      "url": "https://spc.rs/sr/news/2598.praznik-prenosa-mostiju-svetog-nikolaja-u-nikoljcu.html",
      "publisher": "Српска православна црква",
      "original_author": null,
      "checked_on": "2026-09-20",
      "review_status": "reviewed",
      "rights_status": "pending"
    },
    {
      "id": "spc-nicholas",
      "title": "Празник Светог Николаја у Новом Саду",
      "url": "https://www.spc.rs/sr/news/iz-zivota-crkve/12225.praznik-svetog-nikolaja-u-novom-sadu.html",
      "publisher": "Српска православна црква",
      "original_author": null,
      "checked_on": "2026-09-20",
      "review_status": "reviewed",
      "rights_status": "pending"
    },
    {
      "id": "eparhija-michael-chonae",
      "title": "Чудо Светог Архангела Михаила у Хони",
      "url": "https://www.eparhija-sumadijska.org.rs/index.php/vesti/11139-blagovestenje-19092026",
      "publisher": "Епархија шумадијска",
      "original_author": null,
      "checked_on": "2026-09-20",
      "review_status": "reviewed",
      "rights_status": "pending"
    },
    {
      "id": "spc-michael-synaxis",
      "title": "Аранђеловдан у Епархији врањској",
      "url": "https://spc.rs/sr/news/5493.arandelovdan-u-eparhiji-vranjskoj.html",
      "publisher": "Српска православна црква",
      "original_author": null,
      "checked_on": "2026-09-20",
      "review_status": "reviewed",
      "rights_status": "pending"
    },
    {
      "id": "spc-peter-paul",
      "title": "Права вера није лични ударнички подвиг, него је вера Цркве",
      "url": "https://www.spc.rs/sr/news/patrijarh/17190.prava-vera-nije-licni-udarnicki-podvig%2C-nego-je-vera-crkve-.html",
      "publisher": "Српска православна црква",
      "original_author": null,
      "checked_on": "2026-09-20",
      "review_status": "reviewed",
      "rights_status": "pending"
    },
    {
      "id": "eparhija-nativity",
      "title": "Календар: 21.09.2026.",
      "url": "https://kalendar.eparhija.at/2026/9/21",
      "publisher": "Епархија аустријска СПЦ",
      "original_author": null,
      "checked_on": "2026-09-20",
      "review_status": "reviewed",
      "rights_status": "pending"
    },
    {
      "id": "radio-nektarije",
      "title": "Свети Нектарије Егински",
      "url": "https://radioglas.rs/Newsview.asp?ID=2367",
      "publisher": "Радио Глас Епархије нишке",
      "original_author": null,
      "checked_on": "2026-09-20",
      "review_status": "reviewed",
      "rights_status": "pending"
    },
    {
      "id": "spc-stefan-decanski",
      "title": "Свети краљ Стефан Дечански — крсна слава епископа Јеротеја",
      "url": "https://www.spc.rs/sr/news/iz-zivota-crkve/-/12109.sveti-kralj-stefan-decanski-%E2%80%93-krsna-slava-episkopa-jeroteja.html",
      "publisher": "Српска православна црква",
      "original_author": null,
      "checked_on": "2026-09-20",
      "review_status": "reviewed",
      "rights_status": "pending"
    },
    {
      "id": "eparhija-month-01",
      "title": "Епархија аустријска СПЦ — календар",
      "url": "https://www.eparhija.at/kalendar?m=2026-1",
      "publisher": "Епархија аустријска СПЦ",
      "original_author": null,
      "checked_on": "2026-09-15",
      "review_status": "reviewed",
      "rights_status": "pending"
    },
    {
      "id": "eparhija-month-02",
      "title": "Епархија аустријска СПЦ — календар",
      "url": "https://www.eparhija.at/kalendar?m=2026-2",
      "publisher": "Епархија аустријска СПЦ",
      "original_author": null,
      "checked_on": "2026-09-15",
      "review_status": "reviewed",
      "rights_status": "pending"
    },
    {
      "id": "eparhija-month-05",
      "title": "Епархија аустријска СПЦ — календар",
      "url": "https://www.eparhija.at/kalendar?m=2026-5",
      "publisher": "Епархија аустријска СПЦ",
      "original_author": null,
      "checked_on": "2026-09-15",
      "review_status": "reviewed",
      "rights_status": "pending"
    },
    {
      "id": "eparhija-month-07",
      "title": "Епархија аустријска СПЦ — календар",
      "url": "https://www.eparhija.at/kalendar?m=2026-7",
      "publisher": "Епархија аустријска СПЦ",
      "original_author": null,
      "checked_on": "2026-09-15",
      "review_status": "reviewed",
      "rights_status": "pending"
    },
    {
      "id": "eparhija-month-09",
      "title": "Епархија аустријска СПЦ — календар",
      "url": "https://www.eparhija.at/kalendar?m=2026-9",
      "publisher": "Епархија аустријска СПЦ",
      "original_author": null,
      "checked_on": "2026-09-15",
      "review_status": "reviewed",
      "rights_status": "pending"
    },
    {
      "id": "eparhija-month-10",
      "title": "Епархија аустријска СПЦ — календар",
      "url": "https://www.eparhija.at/kalendar?m=2026-10",
      "publisher": "Епархија аустријска СПЦ",
      "original_author": null,
      "checked_on": "2026-09-15",
      "review_status": "reviewed",
      "rights_status": "pending"
    },
    {
      "id": "eparhija-month-11",
      "title": "Епархија аустријска СПЦ — календар",
      "url": "https://www.eparhija.at/kalendar?m=2026-11",
      "publisher": "Епархија аустријска СПЦ",
      "original_author": null,
      "checked_on": "2026-09-15",
      "review_status": "reviewed",
      "rights_status": "pending"
    },
    {
      "id": "eparhija-month-12",
      "title": "Епархија аустријска СПЦ — календар",
      "url": "https://www.eparhija.at/kalendar?m=2026-12",
      "publisher": "Епархија аустријска СПЦ",
      "original_author": null,
      "checked_on": "2026-09-15",
      "review_status": "reviewed",
      "rights_status": "pending"
    },
    {
      "id": "eparhija-month-04",
      "title": "Епархија аустријска СПЦ — календар",
      "url": "https://www.eparhija.at/kalendar?m=2026-4",
      "publisher": "Епархија аустријска СПЦ",
      "original_author": null,
      "checked_on": "2026-09-27",
      "review_status": "reviewed",
      "rights_status": "pending"
    },
    {
      "id": "eparhija-month-08",
      "title": "Епархија аустријска СПЦ — календар",
      "url": "https://www.eparhija.at/kalendar?m=2026-8",
      "publisher": "Епархија аустријска СПЦ",
      "original_author": null,
      "checked_on": "2026-09-27",
      "review_status": "reviewed",
      "rights_status": "pending"
    },
    {
      "id": "eparhija-zt-twelve-great-feasts",
      "title": "Православни основац, број 12 — Дванаест великих празника",
      "url": "https://www.eparhijazt.com/UcitaneSlike/pravoslavni-osnovac-broj-12_compressed.pdf",
      "publisher": "Издавачка кућа Епархије зворничко-тузланске Синај",
      "original_author": "Матеј Горановић",
      "checked_on": "2026-09-27",
      "review_status": "reviewed",
      "rights_status": "pending"
    }
  ],
  "subjects": [
    {
      "id": "saint-paraskeva",
      "type": "saint",
      "name": {
        "sr-Cyrl": "Преподобна мати Параскева",
        "sr-Latn": "Prepodobna mati Paraskeva"
      },
      "aliases": [
        {
          "text": "Света Петка",
          "locale": "sr-Cyrl",
          "kind": "name_variant",
          "source_ids": [
            "eparhija-month-10"
          ]
        },
        {
          "text": "Sveta Petka",
          "locale": "sr-Latn",
          "kind": "name_variant",
          "source_ids": [
            "eparhija-month-10"
          ]
        }
      ],
      "source_ids": [
        "eparhija-month-10"
      ],
      "review_status": "reviewed"
    },
    {
      "id": "saint-sava-serbian",
      "type": "saint",
      "name": {
        "sr-Cyrl": "Свети Сава Српски",
        "sr-Latn": "Sveti Sava Srpski"
      },
      "aliases": [
        {
          "text": "Свети Сава",
          "locale": "sr-Cyrl",
          "kind": "name_variant",
          "source_ids": [
            "eparhija-month-01"
          ]
        },
        {
          "text": "Sveti Sava",
          "locale": "sr-Latn",
          "kind": "name_variant",
          "source_ids": [
            "eparhija-month-01"
          ]
        }
      ],
      "source_ids": [
        "eparhija-month-01"
      ],
      "review_status": "reviewed"
    },
    {
      "id": "saint-nicholas-myra",
      "type": "saint",
      "name": {
        "sr-Cyrl": "Свети Николај Мирликијски",
        "sr-Latn": "Sveti Nikolaj Mirlikijski"
      },
      "aliases": [
        {
          "text": "Свети Никола",
          "locale": "sr-Cyrl",
          "kind": "name_variant",
          "source_ids": [
            "spc-nicholas",
            "spc-nicholas-transfer"
          ]
        },
        {
          "text": "Sveti Nikola",
          "locale": "sr-Latn",
          "kind": "name_variant",
          "source_ids": [
            "spc-nicholas",
            "spc-nicholas-transfer"
          ]
        },
        {
          "text": "Свети Николај",
          "locale": "sr-Cyrl",
          "kind": "name_variant",
          "source_ids": [
            "spc-nicholas",
            "spc-nicholas-transfer"
          ]
        },
        {
          "text": "Sveti Nikolaj",
          "locale": "sr-Latn",